{
  "titel": "Courgette lasagne",
  "beschrijving": "Lichte lasagne van opgerolde courgetteplakken gevuld met ricotta en spinazie, in tomatensaus met gesmolten mozzarella.",
  "personen": 2,
  "tags": ["oven", "vega", "italiaans"],
  "foto": "courgette-lasagne.jpg",
  "bron": "https://miljuschka.nl/courgette-lasagne-recept/",
  "ingredienten": [
    { "id": "courgette", "naam": "courgette", "meervoud": "courgettes", "hoeveelheid": 3, "eenheid": "stuk", "schaling": "stuks", "categorie": "groente-en-fruit" },
    { "id": "olijfolie", "naam": "olijfolie", "hoeveelheid": 2, "eenheid": "el", "schaling": "lineair", "categorie": "olie-en-sauzen" },
    { "id": "ricotta", "naam": "ricotta", "hoeveelheid": 250, "eenheid": "g", "schaling": "lineair", "categorie": "zuivel-en-eieren" },
    { "id": "spinazie", "naam": "verse spinazie", "hoeveelheid": 500, "eenheid": "g", "schaling": "lineair", "categorie": "groente-en-fruit" },
    { "id": "basilicum", "naam": "verse basilicum", "schaling": "vast", "categorie": "groente-en-fruit", "notitie": "handje, fijngesneden, plus extra om te serveren" },
    { "id": "italiaanse-kruiden", "naam": "Italiaanse kruiden", "hoeveelheid": 1, "eenheid": "el", "schaling": "lineair", "categorie": "kruiden-en-specerijen" },
    { "id": "zout-peper", "naam": "zout en peper", "schaling": "vast", "categorie": "kruiden-en-specerijen", "notitie": "naar smaak" },
    { "id": "passata", "naam": "tomatenpassata", "hoeveelheid": 250, "eenheid": "ml", "schaling": "lineair", "categorie": "conserven-en-potten" },
    { "id": "mozzarella", "naam": "bol mozzarella", "meervoud": "bollen mozzarella", "hoeveelheid": 1, "eenheid": "stuk", "schaling": "stuks", "categorie": "kaas" }
  ],
  "stappen": [
    { "tekst": "Snijd {courgette} in dunne plakken (ongeveer 5 plakken per courgette) en leg ze op een bakplaat met bakpapier. Schenk de helft van {olijfolie} erover en breng op smaak met {zout-peper}. Bak de plakken zacht in de oven, ±15–20 minuten.", "duur": 8, "wachttijd": 18, "vereist": { "apparaat": "oven", "temperatuur": 200 } },
    { "tekst": "Verhit intussen de rest van {olijfolie} in een pan op middelhoog vuur en laat {spinazie} er rustig in slinken.", "duur": 5 },
    { "tekst": "Mix in een kom {ricotta}, de geslonken spinazie, {basilicum}, {italiaanse-kruiden} en {zout-peper} tot een romige massa.", "duur": 3 },
    { "tekst": "Leg op iedere courgetteplak een beetje van het ricotta-spinaziemengsel en rol de plakken op.", "duur": 8 },
    { "tekst": "Verspreid het grootste deel van {passata} over de bodem van een ovenschaal en leg de rolletjes erop. Lepel de rest van de passata erover en maak af met {mozzarella}.", "duur": 5 },
    { "tekst": "Bak de courgette lasagne in de oven tot de mozzarella gesmolten en goudbruin is, ±20 minuten.", "duur": 2, "wachttijd": 20, "vereist": { "apparaat": "oven", "temperatuur": 200 } },
    { "tekst": "Serveer, eventueel met extra {basilicum}.", "duur": 1 }
  ]
}
